{
  "$schema": "../../../schemas/bonvoyage-authoring-reason-codes-v1.schema.json",
  "schema_version": 1,
  "classification": "routesphere-bonvoyage-configuration-reason-code-catalog",
  "reason_code_version": "bonvoyage.configuration-reason-codes.v1",
  "contract_version": "bonvoyage.configuration-authoring.v1",
  "compiler_version": "bonvoyage-control-plane-phase4-admin-v1",
  "authority": {
    "registry": "authoring-contract",
    "runtime_diagnostics": "bonvoyage-config",
    "semantic_validation": "snapshot.Compile",
    "presentation_scope": "static-remediation-guidance-only",
    "runtime_message_is_stable_contract": false,
    "network_access": false,
    "live_mutation": false
  },
  "security_boundary": {
    "offline": true,
    "document_values_included": false,
    "secret_values_included": false,
    "environment_secret_reads": false,
    "private_material_included": false
  },
  "sources": {
    "authoring_contract": {
      "path": "config/authoring/bonvoyage-authoring-v1.json",
      "sha256": "098b41f7a57ac3eadff59137b358df8aaf5e6bd5759639f2beaa5b81b39dcebf"
    },
    "reviewed_guidance": {
      "path": "config/authoring/reason-codes/v1/reviewed-guidance.json",
      "sha256": "3dc5e30f26ec6b30f887ebf49256daaddf101133c4547222e4fd478ab6dcdc21"
    }
  },
  "entry_count": 31,
  "entries": [
    {
      "code": "BV_CFG_DIAGNOSTICS_TRUNCATED",
      "class": "operation",
      "default_severity": "warning",
      "retryable": false,
      "anchor": "bv-cfg-diagnostics-truncated",
      "title": "Additional diagnostics omitted",
      "summary": "The diagnostic limit was reached, so the retained entries are valid but the list is incomplete.",
      "operator_action": "Fix the reported errors first, then rerun the operation to reveal any remaining diagnostics."
    },
    {
      "code": "BV_CFG_DIFF_INPUT_INVALID",
      "class": "operation",
      "default_severity": "error",
      "retryable": false,
      "anchor": "bv-cfg-diff-input-invalid",
      "title": "Diff input was rejected",
      "summary": "At least one document supplied to the semantic diff operation did not pass its required checks.",
      "operator_action": "Validate the baseline and proposed documents separately, then correct the rejected input."
    },
    {
      "code": "BV_CFG_EXPLAIN_PATH_UNKNOWN",
      "class": "operation",
      "default_severity": "error",
      "retryable": false,
      "anchor": "bv-cfg-explain-path-unknown",
      "title": "Field path is unknown",
      "summary": "The requested field path is not present in the release-matched explanation catalog.",
      "operator_action": "Select a canonical path from the matching completion metadata and verify the installed release version."
    },
    {
      "code": "BV_CFG_FILE_TYPE_UNSUPPORTED",
      "class": "input",
      "default_severity": "error",
      "retryable": false,
      "anchor": "bv-cfg-file-type-unsupported",
      "title": "Unsupported configuration file type",
      "summary": "Automatic input detection does not recognize the selected file as BonVoyage configuration.",
      "operator_action": "Use a .yaml or .yml regular file, or explicitly select standard input."
    },
    {
      "code": "BV_CFG_FORMAT_UNSAFE",
      "class": "operation",
      "default_severity": "error",
      "retryable": false,
      "anchor": "bv-cfg-format-unsafe",
      "title": "Formatting cannot preserve invariants",
      "summary": "The formatter cannot prove that the requested output preserves the accepted source presentation and meaning.",
      "operator_action": "Keep the original unchanged, correct the reported source or presentation issue, and rerun the operation."
    },
    {
      "code": "BV_CFG_INPUT_ENCODING",
      "class": "input",
      "default_severity": "error",
      "retryable": false,
      "anchor": "bv-cfg-input-encoding",
      "title": "Input is not valid UTF-8",
      "summary": "The selected configuration is not valid UTF-8 input under the authoring contract.",
      "operator_action": "Save the document as valid UTF-8 without replacing or exposing sensitive values."
    },
    {
      "code": "BV_CFG_INPUT_NOT_REGULAR",
      "class": "input",
      "default_severity": "error",
      "retryable": false,
      "anchor": "bv-cfg-input-not-regular",
      "title": "Input is not a regular file",
      "summary": "The selected input kind is outside the bounded regular-file and explicit-standard-input contract.",
      "operator_action": "Select a regular file or use the explicit standard-input mode."
    },
    {
      "code": "BV_CFG_INPUT_SYMLINK",
      "class": "input",
      "default_severity": "error",
      "retryable": false,
      "anchor": "bv-cfg-input-symlink",
      "title": "In-place symlink replacement refused",
      "summary": "The operation refused to replace a symbolic link because its target ownership is not an accepted in-place boundary.",
      "operator_action": "Edit the intended regular file directly, or write the result to a separate output file."
    },
    {
      "code": "BV_CFG_INPUT_TOO_LARGE",
      "class": "input",
      "default_severity": "error",
      "retryable": false,
      "anchor": "bv-cfg-input-too-large",
      "title": "Configuration exceeds the size limit",
      "summary": "The input is larger than the maximum document size supported by this release.",
      "operator_action": "Reduce the document below the release limit and validate the complete result; do not bypass the limit."
    },
    {
      "code": "BV_CFG_INPUT_UNREADABLE",
      "class": "input",
      "default_severity": "error",
      "retryable": true,
      "anchor": "bv-cfg-input-unreadable",
      "title": "Input could not be read",
      "summary": "The selected source could not be opened or read within the bounded input contract.",
      "operator_action": "Check the path, permissions and file availability, then retry the operation."
    },
    {
      "code": "BV_CFG_INTERNAL",
      "class": "internal",
      "default_severity": "error",
      "retryable": false,
      "anchor": "bv-cfg-internal",
      "title": "Internal authoring failure",
      "summary": "The authoring command encountered an internal condition that has no safe user-level interpretation.",
      "operator_action": "Preserve the redacted output and version identities, report a reproducible defect, and do not assume retry success."
    },
    {
      "code": "BV_CFG_MIGRATION_UNSUPPORTED",
      "class": "operation",
      "default_severity": "error",
      "retryable": false,
      "anchor": "bv-cfg-migration-unsupported",
      "title": "Migration path is unavailable",
      "summary": "This release does not ship the requested source-to-target configuration migration.",
      "operator_action": "Use a shipped source and target pair, or follow the documented manual upgrade path."
    },
    {
      "code": "BV_CFG_OPERATION_UNSUPPORTED",
      "class": "operation",
      "default_severity": "error",
      "retryable": false,
      "anchor": "bv-cfg-operation-unsupported",
      "title": "Operation is unavailable",
      "summary": "The selected authoring operation is not supported by the installed command contract.",
      "operator_action": "Use a supported operation or install the BonVoyage release that provides the required operation."
    },
    {
      "code": "BV_CFG_OUTPUT_LIMIT_EXCEEDED",
      "class": "operation",
      "default_severity": "error",
      "retryable": false,
      "anchor": "bv-cfg-output-limit-exceeded",
      "title": "Operation output exceeds its limit",
      "summary": "The bounded result would exceed the maximum output size or item count for this operation.",
      "operator_action": "Reduce the selected input or change set and rerun; treat the refused result as absent, not partial."
    },
    {
      "code": "BV_CFG_PREVIEW_INPUT_INVALID",
      "class": "operation",
      "default_severity": "error",
      "retryable": false,
      "anchor": "bv-cfg-preview-input-invalid",
      "title": "Preview input was rejected",
      "summary": "The proposal or optional local baseline did not pass the checks required for immutable-artifact preview.",
      "operator_action": "Validate the proposal and optional baseline separately, then correct the rejected input."
    },
    {
      "code": "BV_CFG_REFERENCE_DUPLICATE",
      "class": "semantic",
      "default_severity": "error",
      "retryable": false,
      "anchor": "bv-cfg-reference-duplicate",
      "title": "Configuration reference is duplicated",
      "summary": "A resource or binding name is repeated where the compiled configuration requires a unique identity.",
      "operator_action": "Remove or rename the duplicate resource or binding, then revalidate all references."
    },
    {
      "code": "BV_CFG_REFERENCE_MISSING",
      "class": "semantic",
      "default_severity": "error",
      "retryable": false,
      "anchor": "bv-cfg-reference-missing",
      "title": "Configuration reference is unresolved",
      "summary": "A listener, route or policy refers to a resource that is not present in the compiled configuration.",
      "operator_action": "Declare the referenced resource or correct the reference name, then validate the complete document."
    },
    {
      "code": "BV_CFG_SCHEMA_CONSTRAINT",
      "class": "schema",
      "default_severity": "error",
      "retryable": false,
      "anchor": "bv-cfg-schema-constraint",
      "title": "Field violates a configuration constraint",
      "summary": "A field value is outside a structural, literal, length or numeric constraint for this release.",
      "operator_action": "Use the reported path and release-matched field metadata to choose a bounded supported value."
    },
    {
      "code": "BV_CFG_SCHEMA_REQUIRED_FIELD",
      "class": "schema",
      "default_severity": "error",
      "retryable": false,
      "anchor": "bv-cfg-schema-required-field",